tune8_gpuTeslaP100PCIE16GB_x19_y19_c256_mv8.txt
VERSION=8
#shouldUseFP16Storage
0
#shouldUseFP16Compute
0
#shouldUseFP16TensorCores
0
#xGemmDirect
WGD=32 MDIMCD=16 NDIMCD=8 MDIMAD=32 NDIMBD=16 KWID=16 VWMD=1 VWND=2 PADA=1 PADB=1
#xGemm
MWG=32 NWG=32 KWG=32 MDIMC=8 NDIMC=8 MDIMA=8 NDIMB=8 KWI=8 VWM=4 VWN=4 STRM=0 STRN=0 SA=1 SB=1
#xGemm16
MWG=32 NWG=32 KWG=32 MDIMC=8 NDIMC=8 MDIMA=8 NDIMB=8 KWI=8 VWM=4 VWN=4 STRM=0 STRN=0 SA=1 SB=1
#hGemmWmma
MWG=16 NWG=16 KWG=16 MWAVE=16 NWAVE=16 MWARP=16 NWARP=16 VWM=2 VWN=2 SA=0 SB=0
#conv3x3
INTILE_XSIZE=6 INTILE_YSIZE=6 OUTTILE_XSIZE=4 OUTTILE_YSIZE=4 transLocalSize0=64 transLocalSize1=1 untransLocalSize0=8 untransLocalSize1=2 untransLocalSize2=2
#conv5x5
INTILE_XSIZE=6 INTILE_YSIZE=6 OUTTILE_XSIZE=2 OUTTILE_YSIZE=2 transLocalSize0=64 transLocalSize1=1 untransLocalSize0=8 untransLocalSize1=2 untransLocalSize2=2
#gPool
XYSTRIDE=16 CHANNELSTRIDE=2 BATCHSTRIDE=2
