tune8_gpuTeslaP100PCIE16GB_x19_y19_c16_mv9.txt
VERSION=8
#shouldUseFP16Storage
0
#shouldUseFP16Compute
0
#shouldUseFP16TensorCores
0
#xGemmDirect
WGD=8 MDIMCD=8 NDIMCD=8 MDIMAD=8 NDIMBD=8 KWID=1 VWMD=1 VWND=1 PADA=1 PADB=1
#xGemm
MWG=16 NWG=16 KWG=16 MDIMC=8 NDIMC=8 MDIMA=8 NDIMB=8 KWI=2 VWM=2 VWN=2 STRM=0 STRN=0 SA=1 SB=1
#xGemm16
MWG=16 NWG=16 KWG=16 MDIMC=8 NDIMC=8 MDIMA=8 NDIMB=8 KWI=2 VWM=2 VWN=2 STRM=0 STRN=0 SA=1 SB=1
#hGemmWmma
MWG=16 NWG=16 KWG=16 MWAVE=16 NWAVE=16 MWARP=16 NWARP=16 VWM=2 VWN=2 SA=0 SB=0
#conv3x3
INTILE_XSIZE=6 INTILE_YSIZE=6 OUTTILE_XSIZE=4 OUTTILE_YSIZE=4 transLocalSize0=64 transLocalSize1=1 untransLocalSize0=16 untransLocalSize1=2 untransLocalSize2=1
#conv5x5
INTILE_XSIZE=6 INTILE_YSIZE=6 OUTTILE_XSIZE=2 OUTTILE_YSIZE=2 transLocalSize0=64 transLocalSize1=1 untransLocalSize0=16 untransLocalSize1=2 untransLocalSize2=1
#gPool
XYSTRIDE=16 CHANNELSTRIDE=1 BATCHSTRIDE=2
