tune8_gpuTeslaT4_x19_y19_c192_mv8.txt
VERSION=8
#shouldUseFP16Storage
1
#shouldUseFP16Compute
0
#shouldUseFP16TensorCores
1
#xGemmDirect
WGD=32 MDIMCD=8 NDIMCD=8 MDIMAD=16 NDIMBD=16 KWID=8 VWMD=2 VWND=2 PADA=1 PADB=1
#xGemm
MWG=64 NWG=64 KWG=16 MDIMC=16 NDIMC=8 MDIMA=16 NDIMB=8 KWI=2 VWM=4 VWN=4 STRM=0 STRN=0 SA=1 SB=1
#xGemm16
MWG=64 NWG=64 KWG=16 MDIMC=16 NDIMC=8 MDIMA=16 NDIMB=8 KWI=2 VWM=4 VWN=4 STRM=0 STRN=0 SA=1 SB=1
#hGemmWmma
MWG=64 NWG=64 KWG=32 MWAVE=16 NWAVE=16 MWARP=16 NWARP=16 VWM=2 VWN=2 SA=0 SB=0
#conv3x3
INTILE_XSIZE=6 INTILE_YSIZE=6 OUTTILE_XSIZE=4 OUTTILE_YSIZE=4 transLocalSize0=64 transLocalSize1=1 untransLocalSize0=8 untransLocalSize1=16 untransLocalSize2=1
#conv5x5
INTILE_XSIZE=6 INTILE_YSIZE=6 OUTTILE_XSIZE=2 OUTTILE_YSIZE=2 transLocalSize0=64 transLocalSize1=1 untransLocalSize0=8 untransLocalSize1=16 untransLocalSize2=1
#gPool
XYSTRIDE=16 CHANNELSTRIDE=2 BATCHSTRIDE=1
